[
  {
    "id": "recipe-001",
    "category": "layout",
    "intent": "Editorial asymmetric hero",
    "engine": "css",
    "parameters": {},
    "performance": "low",
    "compatibility": {
      "mobile": true,
      "touch": true,
      "reducedMotion": true,
      "r3f": false,
      "vanilla": true
    },
    "tags": [
      "editorial",
      "asymmetric"
    ],
    "dependencies": [],
    "avoidWith": [],
    "sourceConfidence": "SYNTHESIZED",
    "sourceIds": [],
    "mobileStrategy": "reduce amplitude/density and recompose if needed",
    "reducedMotionStrategy": "replace with static/shorter state change"
  },
  {
    "id": "recipe-002",
    "category": "layout",
    "intent": "Object-led product hero",
    "engine": "r3f",
    "parameters": {},
    "performance": "medium",
    "compatibility": {
      "mobile": true,
      "touch": true,
      "reducedMotion": true,
      "r3f": true,
      "vanilla": false
    },
    "tags": [
      "3d",
      "product"
    ],
    "dependencies": [],
    "avoidWith": [],
    "sourceConfidence": "SYNTHESIZED",
    "sourceIds": [],
    "mobileStrategy": "reduce amplitude/density and recompose if needed",
    "reducedMotionStrategy": "replace with static/shorter state change"
  },
  {
    "id": "recipe-003",
    "category": "layout",
    "intent": "Annotated product section",
    "engine": "r3f",
    "parameters": {},
    "performance": "medium",
    "compatibility": {
      "mobile": true,
      "touch": true,
      "reducedMotion": true,
      "r3f": true,
      "vanilla": false
    },
    "tags": [
      "3d",
      "dom-anchor"
    ],
    "dependencies": [],
    "avoidWith": [],
    "sourceConfidence": "SYNTHESIZED",
    "sourceIds": [],
    "mobileStrategy": "reduce amplitude/density and recompose if needed",
    "reducedMotionStrategy": "replace with static/shorter state change"
  },
  {
    "id": "recipe-004",
    "category": "layout",
    "intent": "Immersive chapter stack",
    "engine": "gsap",
    "parameters": {},
    "performance": "medium",
    "compatibility": {
      "mobile": true,
      "touch": true,
      "reducedMotion": true,
      "r3f": false,
      "vanilla": true
    },
    "tags": [
      "scroll",
      "story"
    ],
    "dependencies": [],
    "avoidWith": [],
    "sourceConfidence": "SYNTHESIZED",
    "sourceIds": [],
    "mobileStrategy": "reduce amplitude/density and recompose if needed",
    "reducedMotionStrategy": "replace with static/shorter state change"
  },
  {
    "id": "recipe-005",
    "category": "layout",
    "intent": "Horizontal gallery sequence",
    "engine": "gsap",
    "parameters": {},
    "performance": "medium",
    "compatibility": {
      "mobile": true,
      "touch": true,
      "reducedMotion": true,
      "r3f": false,
      "vanilla": true
    },
    "tags": [
      "scroll",
      "gallery"
    ],
    "dependencies": [],
    "avoidWith": [],
    "sourceConfidence": "SYNTHESIZED",
    "sourceIds": [],
    "mobileStrategy": "reduce amplitude/density and recompose if needed",
    "reducedMotionStrategy": "replace with static/shorter state change"
  },
  {
    "id": "recipe-006",
    "category": "layout",
    "intent": "Split editorial media",
    "engine": "css",
    "parameters": {},
    "performance": "low",
    "compatibility": {
      "mobile": true,
      "touch": true,
      "reducedMotion": true,
      "r3f": false,
      "vanilla": true
    },
    "tags": [
      "editorial",
      "media"
    ],
    "dependencies": [],
    "avoidWith": [],
    "sourceConfidence": "SYNTHESIZED",
    "sourceIds": [],
    "mobileStrategy": "reduce amplitude/density and recompose if needed",
    "reducedMotionStrategy": "replace with static/shorter state change"
  },
  {
    "id": "recipe-007",
    "category": "layout",
    "intent": "Full-bleed case study",
    "engine": "css",
    "parameters": {},
    "performance": "low",
    "compatibility": {
      "mobile": true,
      "touch": true,
      "reducedMotion": true,
      "r3f": false,
      "vanilla": true
    },
    "tags": [
      "case-study"
    ],
    "dependencies": [],
    "avoidWith": [],
    "sourceConfidence": "SYNTHESIZED",
    "sourceIds": [],
    "mobileStrategy": "reduce amplitude/density and recompose if needed",
    "reducedMotionStrategy": "replace with static/shorter state change"
  },
  {
    "id": "recipe-008",
    "category": "layout",
    "intent": "Sticky narrative panel",
    "engine": "gsap",
    "parameters": {},
    "performance": "medium",
    "compatibility": {
      "mobile": true,
      "touch": true,
      "reducedMotion": true,
      "r3f": false,
      "vanilla": true
    },
    "tags": [
      "scroll",
      "sticky"
    ],
    "dependencies": [],
    "avoidWith": [],
    "sourceConfidence": "SYNTHESIZED",
    "sourceIds": [],
    "mobileStrategy": "reduce amplitude/density and recompose if needed",
    "reducedMotionStrategy": "replace with static/shorter state change"
  },
  {
    "id": "recipe-009",
    "category": "layout",
    "intent": "Timeline / chapter rail",
    "engine": "css",
    "parameters": {},
    "performance": "low",
    "compatibility": {
      "mobile": true,
      "touch": true,
      "reducedMotion": true,
      "r3f": false,
      "vanilla": true
    },
    "tags": [
      "navigation",
      "story"
    ],
    "dependencies": [],
    "avoidWith": [],
    "sourceConfidence": "SYNTHESIZED",
    "sourceIds": [],
    "mobileStrategy": "reduce amplitude/density and recompose if needed",
    "reducedMotionStrategy": "replace with static/shorter state change"
  },
  {
    "id": "recipe-010",
    "category": "layout",
    "intent": "Dense utility interface",
    "engine": "css",
    "parameters": {},
    "performance": "low",
    "compatibility": {
      "mobile": true,
      "touch": true,
      "reducedMotion": true,
      "r3f": false,
      "vanilla": true
    },
    "tags": [
      "ui",
      "compact"
    ],
    "dependencies": [],
    "avoidWith": [],
    "sourceConfidence": "SYNTHESIZED",
    "sourceIds": [],
    "mobileStrategy": "reduce amplitude/density and recompose if needed",
    "reducedMotionStrategy": "replace with static/shorter state change"
  },
  {
    "id": "recipe-011",
    "category": "typography",
    "intent": "Line-mask heading reveal",
    "engine": "gsap",
    "parameters": {},
    "performance": "low",
    "compatibility": {
      "mobile": true,
      "touch": true,
      "reducedMotion": true,
      "r3f": false,
      "vanilla": true
    },
    "tags": [
      "text",
      "mask"
    ],
    "dependencies": [],
    "avoidWith": [],
    "sourceConfidence": "SYNTHESIZED",
    "sourceIds": [],
    "mobileStrategy": "reduce amplitude/density and recompose if needed",
    "reducedMotionStrategy": "replace with static/shorter state change"
  },
  {
    "id": "recipe-012",
    "category": "typography",
    "intent": "Word stagger reveal",
    "engine": "gsap",
    "parameters": {},
    "performance": "low",
    "compatibility": {
      "mobile": true,
      "touch": true,
      "reducedMotion": true,
      "r3f": false,
      "vanilla": true
    },
    "tags": [
      "text",
      "stagger"
    ],
    "dependencies": [],
    "avoidWith": [],
    "sourceConfidence": "SYNTHESIZED",
    "sourceIds": [],
    "mobileStrategy": "reduce amplitude/density and recompose if needed",
    "reducedMotionStrategy": "replace with static/shorter state change"
  },
  {
    "id": "recipe-013",
    "category": "typography",
    "intent": "Character wave display",
    "engine": "gsap",
    "parameters": {},
    "performance": "medium",
    "compatibility": {
      "mobile": true,
      "touch": true,
      "reducedMotion": true,
      "r3f": false,
      "vanilla": true
    },
    "tags": [
      "text",
      "display"
    ],
    "dependencies": [],
    "avoidWith": [],
    "sourceConfidence": "SYNTHESIZED",
    "sourceIds": [],
    "mobileStrategy": "reduce amplitude/density and recompose if needed",
    "reducedMotionStrategy": "replace with static/shorter state change"
  },
  {
    "id": "recipe-014",
    "category": "typography",
    "intent": "Editorial italic contrast",
    "engine": "css",
    "parameters": {},
    "performance": "low",
    "compatibility": {
      "mobile": true,
      "touch": true,
      "reducedMotion": true,
      "r3f": false,
      "vanilla": true
    },
    "tags": [
      "type",
      "editorial"
    ],
    "dependencies": [],
    "avoidWith": [],
    "sourceConfidence": "SYNTHESIZED",
    "sourceIds": [],
    "mobileStrategy": "reduce amplitude/density and recompose if needed",
    "reducedMotionStrategy": "replace with static/shorter state change"
  },
  {
    "id": "recipe-015",
    "category": "typography",
    "intent": "Variable-width hover title",
    "engine": "css",
    "parameters": {},
    "performance": "low",
    "compatibility": {
      "mobile": true,
      "touch": true,
      "reducedMotion": true,
      "r3f": false,
      "vanilla": true
    },
    "tags": [
      "variable-font",
      "hover"
    ],
    "dependencies": [],
    "avoidWith": [],
    "sourceConfidence": "SYNTHESIZED",
    "sourceIds": [],
    "mobileStrategy": "reduce amplitude/density and recompose if needed",
    "reducedMotionStrategy": "replace with static/shorter state change"
  },
  {
    "id": "recipe-016",
    "category": "typography",
    "intent": "Scroll-linked tracking",
    "engine": "gsap",
    "parameters": {},
    "performance": "low",
    "compatibility": {
      "mobile": true,
      "touch": true,
      "reducedMotion": true,
      "r3f": false,
      "vanilla": true
    },
    "tags": [
      "text",
      "scroll"
    ],
    "dependencies": [],
    "avoidWith": [],
    "sourceConfidence": "SYNTHESIZED",
    "sourceIds": [],
    "mobileStrategy": "reduce amplitude/density and recompose if needed",
    "reducedMotionStrategy": "replace with static/shorter state change"
  },
  {
    "id": "recipe-017",
    "category": "typography",